<?xml version="1.0" encoding="UTF-8" ?>
<schema xmlns="http://www.w3.org/2001/XMLSchema"
        targetNamespace="http://bean.at16.tsyhanova.it.by"
        xmlns:tns="http://bean.at16.tsyhanova.it.by"
        elementFormDefault="qualified">
    <element name="sites">
        <complexType>
            <sequence>
                <element name="site"
                         type="tns:typeSite"
                         minOccurs="1"
                         maxOccurs="unbounded"/>
            </sequence>
        </complexType>
    </element>
    <complexType name="typeSite">
        <sequence>
            <element name="pages"
                     type="tns:typePages"/>
        </sequence>
        <attribute name="url" type="string"/>
    </complexType>
    <complexType name="typePages">
        <sequence>
            <element name="page"
                     type="tns:typePage"
                     maxOccurs="unbounded"/>
        </sequence>
    </complexType>
    <complexType name="typePage">
        <sequence>
            <element name="uri" type="string"/>
            <element name="elements"
                     type="tns:typeElements"
                     minOccurs="1"
                     maxOccurs="1"/>
        </sequence>
        <attribute name="title" type="string"/>
    </complexType>
    <complexType name="typeElements">
        <sequence>
            <element name="element"
                     type="tns:typeElement"
                     minOccurs="1"
                     maxOccurs="unbounded"/>
        </sequence>
    </complexType>
    <complexType name="typeElement">
        <simpleContent>
            <extension base="string">
                <attribute name="name" type="string"></attribute>
            </extension>
        </simpleContent>
    </complexType>
    <simpleType name="name">
        <restriction base="string">
            <enumeration value="head" />
            <enumeration value="body" />
            <enumeration value="form" />
        </restriction>
    </simpleType>
</schema>