<?xml version="1.0" encoding="UTF-8" ?>
<sites xmlns="http://bean.at16.tsyhanova.it.by"
       xmlns:xsi="http://www.w3.org/2001/XMLSchema-instance"
        xsi:schemaLocation="http://bean.at16.tsyhanova.it.by sites.xsd">
    <site url="http://it.by">
        <pages>
            <page title="Main Page">
                <uri>/index</uri>
                <elements>
                    <element name="head">
                        head for main
                    </element>
                    <element name="body">
                        body for main
                    </element>
                </elements>
            </page>
            <page title="Login Page">
                <uri>/login</uri>
                <elements>
                    <element name="head">
                        head for login
                    </element>
                    <element name="form">
                        body for login
                    </element>
                </elements>
            </page>
        </pages>
    </site>
    <site url="http://ya.by">
        <pages>
            <page title="Index Page">
                <uri>/index</uri>
                <elements>
                    <element name="head">
                        Search Yandex
                    </element>
                    <element name="form">
                        Search form
                    </element>
                </elements>
            </page>
            <page title="Search Result">
                <uri>/result</uri>
                <elements>
                    <element name="head">
                       Search result Yandex
                    </element>
                    <element name="content">
                        Some content
                    </element>
                </elements>
            </page>
        </pages>
    </site>
</sites>